{
  "$schema": "https://raw.githubusercontent.com/ayan4m1/vast-ai-provisioner/main/module.schema.json",
  "name": "Flux 3 Klein",
  "template": "ComfyUI",
  "gated": true,
  "files": {
    "diffusion_models": [
      "https://huggingface.co/black-forest-labs/flux-3-image-klein-comfy/resolve/main/diffusion_models/flux3-image-klein-base-int8-convrot.safetensors",
      "https://huggingface.co/black-forest-labs/flux-3-image-klein-comfy/resolve/main/diffusion_models/flux3-image-klein-int8-convrot.safetensors"
    ],
    "text_encoder_models": [
      "https://huggingface.co/black-forest-labs/flux-3-image-klein-comfy/resolve/main/text_encoders/qwen3.5_9b_flux3_prompt_upsampler_int8_convrot.safetensors",
      "https://huggingface.co/black-forest-labs/flux-3-image-klein-comfy/resolve/main/text_encoders/qwen3vl_4b_int8_convrot.safetensors"
    ],
    "vae_models": [
      "https://huggingface.co/black-forest-labs/flux-3-image-klein-comfy/resolve/main/vae/flux2-vae.safetensors"
    ],
    "nodes": [],
    "workflows": [
      "https://huggingface.co/black-forest-labs/flux-3-image-klein-comfy/resolve/main/workflows/flux3_klein_base_int8_i2i.json",
      "https://huggingface.co/black-forest-labs/flux-3-image-klein-comfy/resolve/main/workflows/flux3_klein_base_int8_t2i.json"
    ]
  }
}
